{
  "$schema": "../../node_modules/playson/schemas/testsuite.schema.json",
  "title": "Auth Me",
  "description": "Tests for the /auth/me endpoint",
  "tags": ["automated", "auth", "me"],
  "testCases": [
    {
      "id": "auth-me-pos-001",
      "title": "Get own profile with valid token",
      "testType": "positive",
      "tags": ["positive", "get", "auth", "p1", "smoke", "regression", "e2e"],
      "variables": {
        "meEmail": {
          "$gen": "email",
          "provider": "example.com"
        },
        "mePassword": {
          "$gen": "alphanumeric",
          "length": "{{DEFAULT_PWD_LENGTH}}"
        },
        "meFirstname": {
          "$gen": "firstName"
        },
        "meLastname": {
          "$gen": "lastName"
        }
      },
      "steps": [
        {
          "title": "Register a new user",
          "request": {
            "method": "POST",
            "endpoint": "/auth/register",
            "payload": {
              "email": "{{meEmail}}",
              "password": "{{mePassword}}",
              "firstname": "{{meFirstname}}",
              "lastname": "{{meLastname}}"
            }
          },
          "response": {
            "validations": {
              "statusCode": 201
            }
          }
        },
        {
          "title": "Login to get token",
          "request": {
            "method": "POST",
            "endpoint": "/auth/login",
            "payload": {
              "email": "{{meEmail}}",
              "password": "{{mePassword}}"
            }
          },
          "response": {
            "validations": {
              "statusCode": 200
            },
            "extract": [
              {
                "name": "meToken",
                "from": "body",
                "path": "$.token",
                "scope": "case"
              }
            ]
          }
        },
        {
          "title": "Get own profile",
          "request": {
            "method": "GET",
            "endpoint": "/auth/me",
            "headers": {
              "Authorization": "Bearer {{meToken}}"
            }
          },
          "response": {
            "schema": {
              "name": "User"
            },
            "validations": {
              "statusCode": 200,
              "assertions": [
                {
                  "title": "Email matches registered user",
                  "from": "body",
                  "path": "$.user.email",
                  "operator": "equalsIgnoreCase",
                  "value": "{{meEmail}}"
                },
                {
                  "title": "Firstname matches registered user",
                  "from": "body",
                  "path": "$.user.firstname",
                  "operator": "equals",
                  "value": "{{meFirstname}}"
                }
              ]
            }
          }
        }
      ]
    },
    {
      "id": "auth-me-neg-unauthorized",
      "title": "Fail to get profile without valid token",
      "testType": "negative",
      "tags": ["negative", "get", "auth", "p2", "regression"],
      "steps": [
        {
          "title": "Get profile without token",
          "request": {
            "method": "GET",
            "endpoint": "/auth/me"
          },
          "response": {
            "schema": {
              "name": "Error"
            },
            "validations": {
              "statusCode": 401
            }
          }
        },
        {
          "title": "Get profile with invalid token",
          "request": {
            "method": "GET",
            "endpoint": "/auth/me",
            "headers": {
              "Authorization": "Bearer invalid-token"
            }
          },
          "response": {
            "schema": {
              "name": "Error"
            },
            "validations": {
              "statusCode": 401
            }
          }
        }
      ]
    }
  ]
}
