{
  "$schema": "../../Project-schema/testsuite.schema.json",
  "title": "Auth Refresh",
  "description": "Tests for the /auth/refresh endpoint",
  "tags": ["automated", "auth", "refresh"],
  "testCases": [
    {
      "id": "auth-refresh-pos-001",
      "title": "Refresh token successfully with valid token",
      "testType": "positive",
      "tags": ["positive", "post", "auth", "p1", "smoke", "regression", "e2e"],
      "variables": {
        "refreshEmail": {
          "$gen": "email",
          "provider": "example.com"
        },
        "refreshPassword": {
          "$gen": "alphanumeric",
          "length": "{{DEFAULT_PWD_LENGTH}}"
        }
      },
      "steps": [
        {
          "title": "Register a new user",
          "request": {
            "method": "POST",
            "endpoint": "/auth/register",
            "payload": {
              "email": "{{refreshEmail}}",
              "password": "{{refreshPassword}}",
              "firstname": {
                "$gen": "firstName"
              },
              "lastname": {
                "$gen": "lastName"
              }
            }
          },
          "response": {
            "validations": {
              "statusCode": 201
            }
          }
        },
        {
          "title": "Login to get token",
          "request": {
            "method": "POST",
            "endpoint": "/auth/login",
            "payload": {
              "email": "{{refreshEmail}}",
              "password": "{{refreshPassword}}"
            }
          },
          "response": {
            "validations": {
              "statusCode": 200
            },
            "extract": [
              {
                "name": "refreshToken",
                "from": "body",
                "path": "$.token",
                "scope": "case"
              }
            ]
          }
        },
        {
          "title": "Refresh token",
          "request": {
            "method": "POST",
            "endpoint": "/auth/refresh",
            "headers": {
              "Authorization": "Bearer {{refreshToken}}"
            }
          },
          "response": {
            "schema": {
              "name": "Error"
            },
            "validations": {
              "statusCode": 200,
              "assertions": [
                {
                  "title": "Success is true",
                  "from": "body",
                  "path": "$.success",
                  "operator": "equals",
                  "value": true
                }
              ]
            }
          }
        }
      ]
    },
    {
      "id": "auth-refresh-neg-unauthorized",
      "title": "Fail to refresh token without valid token",
      "testType": "negative",
      "tags": ["negative", "post", "auth", "p2", "regression"],
      "steps": [
        {
          "title": "Refresh attempt without token",
          "request": {
            "method": "POST",
            "endpoint": "/auth/refresh"
          },
          "response": {
            "schema": {
              "name": "Error"
            },
            "validations": {
              "statusCode": 401
            }
          }
        },
        {
          "title": "Refresh attempt with invalid token",
          "request": {
            "method": "POST",
            "endpoint": "/auth/refresh",
            "headers": {
              "Authorization": "Bearer invalid-token"
            }
          },
          "response": {
            "schema": {
              "name": "Error"
            },
            "validations": {
              "statusCode": 401
            }
          }
        }
      ]
    }
  ]
}
