{
  "title": "Auth Login",
  "description": "Tests for the /auth/login endpoint",
  "tags": ["automated", "auth", "login"],
  "beforeAll": [
    {
      "title": "Register suite login user",
      "request": {
        "method": "POST",
        "endpoint": "{{REGISTER_PATH}}",
        "payload": {
          "email": "playson.{{$timestamp}}@playson.com",
          "password": "Password@123",
          "firstname": "Login",
          "lastname": "Suite"
        }
      },
      "response": {
        "schema": {
          "name": "User"
        },
        "validations": {
          "statusCode": 201
        },
        "extract": [
          {
            "name": "loginEmail",
            "from": "body",
            "path": "$.user.email",
            "scope": "suite"
          }
        ]
      }
    },
    {
      "title": "Login suite user for cleanup",
      "request": {
        "method": "POST",
        "endpoint": "{{LOGIN_PATH}}",
        "payload": {
          "email": "{{loginEmail}}",
          "password": "Password@123"
        }
      },
      "response": {
        "schema": {
          "name": "LoginResponse"
        },
        "validations": {
          "statusCode": 200
        },
        "extract": [
          {
            "name": "loginToken",
            "from": "body",
            "path": "$.token",
            "scope": "suite"
          }
        ]
      }
    }
  ],
  "afterAll": [
    {
      "title": "Delete suite login user",
      "request": {
        "method": "DELETE",
        "endpoint": "/user",
        "headers": {
          "Authorization": "Bearer {{loginToken}}"
        }
      },
      "response": {
        "schema": {
          "name": "Error"
        },
        "validations": {
          "statusCode": 200
        }
      }
    }
  ],
  "testCases": [
    {
      "id": "auth-login-pos-001",
      "title": "Login with valid credentials",
      "testType": "positive",
      "tags": ["positive", "post", "auth"],
      "steps": [
        {
          "title": "Login with registered credentials",
          "request": {
            "method": "POST",
            "endpoint": "{{LOGIN_PATH}}",
            "payload": {
              "email": "{{loginEmail}}",
              "password": "Password@123"
            }
          },
          "response": {
            "schema": {
              "name": "LoginResponse"
            },
            "validations": {
              "statusCode": 200,
              "assertions": [
                {
                  "title": "Token is present",
                  "from": "body",
                  "path": "$.token",
                  "operator": "exists"
                },
                {
                  "title": "User info is returned",
                  "from": "body",
                  "path": "$.user",
                  "operator": "exists"
                }
              ]
            }
          }
        }
      ]
    },
    {
      "id": "auth-login-neg-invalid-creds",
      "title": "Fail to login with wrong credentials",
      "testType": "negative",
      "tags": ["negative", "post", "auth"],
      "steps": [
        {
          "title": "Login with wrong password",
          "request": {
            "method": "POST",
            "endpoint": "{{LOGIN_PATH}}",
            "payload": {
              "email": "{{loginEmail}}",
              "password": "WrongPassword"
            }
          },
          "response": {
            "schema": {
              "name": "Error"
            },
            "validations": {
              "statusCode": 401,
              "assertions": [
                {
                  "title": "Error message matches",
                  "from": "body",
                  "path": "$.error",
                  "operator": "equals",
                  "value": "Invalid email or password"
                }
              ]
            }
          }
        }
      ]
    },
    {
      "id": "auth-login-neg-validation",
      "title": "Fail to login with invalid data",
      "testType": "negative",
      "tags": ["negative", "post", "auth", "validation"],
      "steps": [
        {
          "title": "Invalid email format",
          "request": {
            "method": "POST",
            "endpoint": "{{LOGIN_PATH}}",
            "payload": {
              "email": "not-an-email",
              "password": "Password123"
            }
          },
          "response": {
            "validations": {
              "statusCode": [401, 422],
              "assertions": []
            }
          }
        },
        {
          "title": "Missing fields",
          "request": {
            "method": "POST",
            "endpoint": "{{LOGIN_PATH}}",
            "payload": {}
          },
          "response": {
            "validations": {
              "statusCode": 422,
              "assertions": [
                {
                  "title": "Error list includes required messages",
                  "from": "body",
                  "path": "$.errors",
                  "operator": "includes",
                  "value": "'email' is required"
                }
              ]
            }
          }
        }
      ]
    }
  ]
}
